{
  "$schema": "https://json-schema.org/draft/2020-12/schema",
  "$id": "https://hummbl.dev/schemas/tuples/workload_inferred.schema.json",
  "title": "WORKLOAD_INFERRED Tuple",
  "type": "object",
  "additionalProperties": false,
  "required": [
    "tuple_type",
    "subject_id",
    "run_id",
    "control_mode",
    "tuple_data"
  ],
  "properties": {
    "tuple_type": { "const": "WORKLOAD_INFERRED" },
    "subject_id": { "type": "string", "minLength": 1 },
    "run_id": { "type": "string", "minLength": 1 },
    "control_mode": {
      "type": "string",
      "enum": [
        "AI_AUTONOMOUS",
        "AI_PROPOSE_HUMAN_CONFIRM",
        "HITL",
        "HOTL",
        "HUMAN_CONTROLLED"
      ]
    },
    "tuple_data": {
      "type": "object",
      "additionalProperties": true,
      "required": [
        "workload_state",
        "drivers",
        "confidence",
        "review_required"
      ],
      "properties": {
        "workload_state": { "type": "string", "minLength": 1 },
        "drivers": {
          "type": "array",
          "minItems": 1,
          "items": { "type": "string", "minLength": 1 }
        },
        "confidence": { "type": "number", "minimum": 0 },
        "review_required": { "type": "boolean" }
      }
    }
  }
}
